Source: pi_monitor_alert
Date: 2026-10-01T09:21:59+10:00
From: xindy.notifications@gmail.com
To: xindy.notifications@gmail.com
Subject: [Pi Monitor] SMART_NVME CRIT

SMART health FAIL on /dev/nvme0n1

NVMe attributes:
  available_spare=100%
  percentage_used=0%
  media_errors=0
  temp=36C

SMART output:
smartctl 7.4 2023-08-01 r5530 [aarch64-linux-6.18.34+rpt-rpi-2712] (local build)
Copyright (C) 2002-23, Bruce Allen, Christian Franke, www.smartmontools.org

=== START OF SMART DATA SECTION ===
SMART overall-health self-assessment test result: PASSED

SMART/Health Information (NVMe Log 0x02)
Critical Warning:                   0x00
Temperature:                        36 Celsius
Available Spare:                    100%
Available Spare Threshold:          10%
Percentage Used:                    0%
Data Units Read:                    1,398,126 [715 GB]
Data Units Written:                 3,241,246 [1.65 TB]
Host Read Commands:                 15,191,219
Host Write Commands:                97,046,225
Controller Busy Time:               15,994
Power Cycles:                       91
Power On Hours:                     4,990
Unsafe Shutdowns:                   47
Media and Data Integrity Errors:    0
Error Information Log Entries:      1,169,624
Warning  Comp. Temperature Time:    0
Critical Comp. Temperature Time:    0
Temperature Sensor 2:               53 Celsius
